http://rashodnika.net/9_1_3_1.html;Xerox Черный картридж большой емкости;008R07638
http://rashodnika.net/9_1_3_2.html;Xerox Печатающая головка цветная;008R07659
http://rashodnika.net/9_1_3_3.html;Xerox Струйный картридж черный;008R07660
http://rashodnika.net/9_1_3_4.html;Xerox Струйный картридж голубой;008R07661
http://rashodnika.net/9_1_3_5.html;Xerox Струйный картридж пурпурный;008R07662
http://rashodnika.net/9_1_3_6.html;Xerox Струйный картридж желтый;008R07663
http://rashodnika.net/9_1_3_7.html;Xerox Печатающая головка цветная;008R07871
http://rashodnika.net/9_1_3_8.html;Xerox Струйный картридж цветной;008R07880
http://rashodnika.net/9_1_3_9.html;Xerox Струйный картридж черный;008R07881
http://rashodnika.net/9_1_3_10.html;Xerox Струйный картридж цветной большой емкости;008R07882
http://rashodnika.net/9_1_3_11.html;Xerox Струйный фото картридж;008R07883
http://rashodnika.net/9_1_3_12.html;Xerox Струйный картридж черный;008R07903
http://rashodnika.net/9_1_3_13.html;Xerox P100 Печатающая головка черная;008R07969
http://rashodnika.net/9_1_3_14.html;Xerox P105 Печатающая головка цветная;008R07970
http://rashodnika.net/XX008R07971.html;Xerox H100 Струйный картридж черный;008R07971
http://rashodnika.net/9_1_3_15.html;Xerox Y101 Чернильница голубая;008R07972
http://rashodnika.net/9_1_3_16.html;Xerox Y102 Чернильница пурпурная;008R07973
http://rashodnika.net/9_1_3_17.html;Xerox Y103 Чернильница желтая;008R07974
http://rashodnika.net/9_1_3_18.html;Xerox Чернильница черная 2шт.;008R07994
http://rashodnika.net/9_1_3_19.html;Xerox Печатающая головка цветная;008R07999
http://rashodnika.net/9_1_3_20.html;Xerox Струйный картридж цветной;008R12591
http://rashodnika.net/9_1_3_21.html;Xerox Y100 Чернильница черная;008R12728
http://rashodnika.net/9_1_3_22.html;Xerox Струйный картридж цветной;008R12805
http://rashodnika.net/9_1_3_23.html;XEROX Чернила светло-голубые пигментные;008R12909
http://rashodnika.net/9_1_3_24.html;XEROX Чернила черные пигментные;008R12910
http://rashodnika.net/9_1_3_25.html;XEROX Чернила светло-пурпурные с картриджем;008R12969
http://rashodnika.net/9_1_3_26.html;XEROX Чернила светло-голубые с картриджем;008R12970
http://rashodnika.net/9_1_3_27.html;XEROX Чернила черные с картриджем;008R12971
http://rashodnika.net/9_1_3_28.html;XEROX Чернила желтые с картриджем;008R12972
http://rashodnika.net/9_1_3_29.html;XEROX Чернила пурпурные с картриджем;008R12973
http://rashodnika.net/9_1_3_30.html;XEROX Чернила голубые с картриджем;008R12974
http://rashodnika.net/9_1_3_31.html;XEROX Чернила светло-пурпурные пигментные;008R12975
http://rashodnika.net/9_1_3_32.html;XEROX Чернила голубые пигментные с картриджем;008R12976
http://rashodnika.net/9_1_3_33.html;XEROX Чернила пурпурные пигментные с картриджем;008R12977
http://rashodnika.net/9_1_3_34.html;XEROX Чернила желтые пигментные с картриджем;008R12978
http://rashodnika.net/9_1_3_35.html;XEROX Чернила черные пигментные с картриджем;008R12979
http://rashodnika.net/9_1_3_36.html;XEROX Чернила светло-голубые пигментные с картриджем;008R12980
http://rashodnika.net/9_1_3_37.html;XEROX Чернила светло-пурпурные пигментные с картриджем;008R12981
http://rashodnika.net/9_1_3_38.html;XEROX Чернила голубые;008R12991
http://rashodnika.net/9_1_3_39.html;XEROX Чернила пурпурные;008R12992
http://rashodnika.net/9_1_3_40.html;XEROX Чернила желтые;008R12993
http://rashodnika.net/9_1_3_41.html;XEROX Чернила черные;008R12994
http://rashodnika.net/9_1_3_42.html;XEROX Чернила светло-голубые;008R12995
http://rashodnika.net/9_1_3_43.html;XEROX Чернила светло-пурпурные;008R12996
http://rashodnika.net/9_1_3_44.html;XEROX Чернила голубые пигментные;008R12997
http://rashodnika.net/9_1_3_45.html;XEROX Чернила пурпурные пигментные;008R12998
http://rashodnika.net/9_1_3_46.html;XEROX Чернила желтые пигментные;008R12999
http://rashodnika.net/XX008R13110.html;XEROX Черная печатающая головка;008R13110
http://rashodnika.net/XX008R13111.html;XEROX Голубая печатающая головка;008R13111
http://rashodnika.net/XX008R13112.html;XEROX Пурпурная печатающая головка;008R13112
http://rashodnika.net/XX008R13113.html;XEROX Желтая печатающая головка;008R13113
http://rashodnika.net/XX008R13122.html;XEROX Чернила черные;008R13122
http://rashodnika.net/XX008R13123.html;XEROX Чернила голубые;008R13123
http://rashodnika.net/XX008R13124.html;XEROX Чернила пурпурные;008R13124
http://rashodnika.net/XX008R13125.html;XEROX Чернила желтые;008R13125
http://rashodnika.net/XX008R13152.html;Xerox Струйный картридж черный;008R13152
http://rashodnika.net/XX008R13153.html;Xerox Струйный картридж голубой;008R13153
http://rashodnika.net/XX008R13154.html;Xerox Струйный картридж пурпурный;008R13154
http://rashodnika.net/XX008R13155.html;Xerox Струйный картридж желтый;008R13155
http://rashodnika.net/9_1_3_47.html;XEROX Чернила черные сублимационные;026R00693
http://rashodnika.net/9_1_3_48.html;XEROX Чернила голубые сублимационные;026R00694
http://rashodnika.net/9_1_3_49.html;XEROX Чернила пурпурные сублимационные;026R00695
http://rashodnika.net/9_1_3_50.html;XEROX Чернила желтые сублимационные;026R00696
http://rashodnika.net/9_1_3_51.html;XEROX Чернила светло-голубые сублимационные;026R00697
http://rashodnika.net/9_1_3_52.html;XEROX Чернила светло-пурпурные сублимационные;026R00698
http://rashodnika.net/9_1_3_53.html;XEROX Чернила черные сублимационные;026R00711
http://rashodnika.net/9_1_3_54.html;XEROX Чернила голубые сублимационные;026R00712
http://rashodnika.net/9_1_3_55.html;XEROX Чернила пурпурные сублимационные;026R00713
http://rashodnika.net/9_1_3_56.html;XEROX Чернила желтые сублимационные;026R00714
http://rashodnika.net/9_1_3_57.html;XEROX Чернила светло-голубые сублимационные;026R00715
http://rashodnika.net/9_1_3_58.html;XEROX Чернила светло-пурпурные сублимационные;026R00716
http://rashodnika.net/9_1_3_59.html;XEROX Комплект голубых чернил;026R09950
http://rashodnika.net/9_1_3_60.html;XEROX Комплект пурпурных чернил;026R09951
http://rashodnika.net/9_1_3_61.html;XEROX Комплект желтых чернил;026R09952
http://rashodnika.net/9_1_3_62.html;XEROX Комплект черных чернил;026R09953
http://rashodnika.net/9_1_3_63.html;XEROX Картридж голубой;026R09954
http://rashodnika.net/9_1_3_64.html;XEROX Картридж пурпурный;026R09955
http://rashodnika.net/9_1_3_65.html;XEROX Картридж желтый;026R09956
http://rashodnika.net/9_1_3_66.html;XEROX Картридж черный;026R09957
http://rashodnika.net/9_1_3_67.html;XEROX Чернила черные 220мл;106R01227
http://rashodnika.net/9_1_3_68.html;XEROX Чернила голубые 220мл;106R01228
http://rashodnika.net/9_1_3_69.html;XEROX Чернила пурпурные 220мл;106R01229
http://rashodnika.net/9_1_3_70.html;XEROX Чернила желтые 220мл;106R01230
http://rashodnika.net/9_1_3_71.html;XEROX Чернила желтые 440мл;106R01251
http://rashodnika.net/9_1_3_72.html;XEROX Чернила голубые 440мл;106R01252
http://rashodnika.net/9_1_3_73.html;XEROX Чернила пурпурные 440мл;106R01253
http://rashodnika.net/9_1_3_74.html;XEROX Чернила желтые 440мл;106R01254
http://rashodnika.net/9_1_3_75.html;XEROX Картридж с черными чернилами 220мл;106R01300
http://rashodnika.net/9_1_3_76.html;XEROX Картридж с голубыми чернилами 220мл;106R01301
http://rashodnika.net/9_1_3_77.html;XEROX Картридж с пурпурными чернилами 220мл;106R01302
http://rashodnika.net/9_1_3_78.html;XEROX Картридж с желтыми чернилами 220мл;106R01303
http://rashodnika.net/9_1_3_79.html;XEROX Картридж с черными чернилами 110мл;106R01307
http://rashodnika.net/9_1_3_80.html;XEROX Картридж с голубыми чернилами 110мл;106R01308
http://rashodnika.net/9_1_3_81.html;XEROX Картридж с пурпурными чернилами 110мл;106R01309
http://rashodnika.net/9_1_3_82.html;XEROX Картридж с желтыми чернилами 110мл;106R01310
http://rashodnika.net/XX106R02205.html;XEROX Картридж с черными пигментными чернилами 220мл;106R02205
http://rashodnika.net/XX106R02206.html;XEROX Картридж с голубыми пигментными чернилами 220мл;106R02206
http://rashodnika.net/XX106R02207.html;XEROX Картридж с пурпурными пигментными чернилами 220мл;106R02207
http://rashodnika.net/XX106R02208.html;XEROX Картридж с желтыми пигментными чернилами 220мл;106R02208
http://rashodnika.net/9_1_3_83.html;XEROX Картридж для очистки;108R00735
http://rashodnika.net/XX108R00753.html;XEROX Емкость для отработанных чернил;108R00753
http://rashodnika.net/9_1_3_84.html;XEROX Картридж промывочный;108R00814
